80111,"NSLOCTEXT("""", ""0532906F4F4D5B3743F2C38BBD1FA67B"", ""Rawhide Bedroll"")","NSLOCTEXT("""", ""FFEA92E84825349C42CEAFB196618CEB"", ""A rawhide bedroll for sleeping on the ground."")","NSLOCTEXT("""", ""8ED030B84F8578E47A75B3A00D5C479D"", ""Roughly sewn together from the hides of animals, this bedroll offers warmth and some small protection from sharp rocks and twigs on the grounds.\nThe price, of course, is the sharp smell of untreated leather and the occasional unwanted attentions of passing animals.\nWhen somebody dies in the Exiled Lands, they awaken in the last place that they slept, unaware of how or why they got there. Using a bedroll will set it as your spawn point temporarily, until you have died once."")","/Game/UI/Textures/Icons/icon_bedroll-1.icon_bedroll-1","/Script/ConanSandbox.BuildingItem","/Game/Systems/Building/Placeables/BP_PL_Bedroll_Clean.BP_PL_Bedroll_Clean_C","/Game/Items/GatheringResources/Rock1.Rock1_C","None","1","0","BuildingItem","0.000000","0","None","OneHanded","","0","0","0","0","0.000000","0.000000","1.000000","0.000000","0.000000","0","0","0","0","0","0","0","0","0","0","0.000000","0.000000","0.000000","0.000000","0.000000","1","0.000000","0","0","0","0","Default","0","0","0","None","None","None","0","0","0","0.000000","0","-1.000000","0","0","1","0","0","1","0","0","1","0","1","0","","","","","0","0","0.000000","1","0","None","-1"
80112,"NSLOCTEXT("""", ""E65EE498488DDC54C1099FAFCF0642C2"", ""Fiber Bedroll"")","NSLOCTEXT("""", ""4C5B914248BB2A05A8F27E84C00B313D"", ""A mattress of leaves, twigs and grass."")","NSLOCTEXT("""", ""B223FDA74E41D55100FE118E0E522BE7"", ""A hastily gathered bundle of fibers stripped from the plants and vegetation that dot the Exiled Lands, this bedroll offers very little in the way warmth or protection.\nIt?s probably better than lying on the hard ground though. Slightly.\nWhen somebody dies in the Exiled Lands, they awaken in the last place that they slept, unaware of how or why they got there. Using a bedroll will set it as your spawn point temporarily, until you have died once."")","/Game/UI/Textures/Icons/icon_bedroll_plant_fiber.icon_bedroll_plant_fiber","/Script/ConanSandbox.BuildingItem","/Game/Systems/Building/Placeables/BP_PL_Bedroll_Fiber.BP_PL_Bedroll_Fiber_C","/Game/Items/GatheringResources/Rock1.Rock1_C","None","1","0","BuildingItem","0.000000","0","None","OneHanded","","0","0","0","0","0.000000","0.000000","1.000000","0.000000","0.000000","0","0","0","0","0","0","0","0","0","0","0.000000","0.000000","0.000000","0.000000","0.000000","1","0.000000","0","0","0","0","Default","0","0","0","None","None","None","0","0","0","0.000000","0","-1.000000","0","0","1","0","0","1","12001","5","1","0","1","0","","","","","0","0","0.000000","1","0","None","-1"
80121,"NSLOCTEXT("""", ""0873D96140027B9D520F72AADE14B817"", ""Sandstorm Tent"")","NSLOCTEXT("""", ""FD37ED2D474B9F845E171AAB4D4F2821"", ""A simple tent that offers protection against sandstorms"")","NSLOCTEXT("""", ""DE83901041A156698AC36EB217C2901F"", ""The Zuagir, a tribe of shemite nomads who roam the sands from Zamora to Zamboula, created these tents as a rather novel way to ride out the sandstorms which sweep the deserts of Hyboria.\nMade of woven camel-hair, these tents are deployed quickly and with little fuss and are actually quite a comfortable place to ride out a sandstorm.\nSandstorms in the Exiled Lands contain more than just wind-blown sand and flying fragments. There are darker terrors against which woven camelhair may not prove particularly effective.\nOnce a tent is placed, hiding inside is as simple as using it."")","/Game/UI/Textures/Icons/icon_DEV_needs_icon.icon_DEV_needs_icon","/Script/ConanSandbox.BuildingItem","/Game/Systems/Building/Placeables/BP_PL_Tent_Small_1_Spawn.BP_PL_Tent_Small_1_Spawn_C","/Game/Items/GatheringResources/Rock1.Rock1_C","None","1","0","BuildingItem","0.000000","0","None","OneHanded","","0","0","0","0","0.000000","0.000000","5.000000","0.000000","0.000000","0","0","0","0","0","0","0","0","0","0","0.000000","0.000000","0.000000","0.000000","0.000000","2","0.000000","0","0","0","0","Default","0","0","0","None","None","None","0","0","0","0.000000","0","-1.000000","0","0","1","0","0","1","0","0","1","0","8","0","","","","","0","0","0.000000","5","0","None","-1"
80131,"NSLOCTEXT("""", ""D8F7FB01487C89F0213955876C679AC3"", ""Water Well"")","NSLOCTEXT("""", ""AE081C114641F4C1678ABE89396B1217"", ""A well that fills slowly over time"")","NSLOCTEXT("""", ""F140FE0F498EB9F602D1FEA6171EF9D8"", ""Made from rough stones and wood, this well manages to capture a small amount of water.\nWater is an essential element for survival and this is doubly the case in the desert environments of the Exiled Lands. Any permanent settlement near water will inevitable be contested by others who also seek access to this life affirming resource.\nThe convenience of a well allows building in areas that would otherwise be unsustainable. Wells fill with water over time and can be used to quench thirst, replenish waterskins and perform the dozens of other activities that require the presence of water."")","/Game/UI/Textures/Icons/icon_large_water_well.icon_large_water_well","/Script/ConanSandbox.BuildingItem","/Game/Systems/Building/Placeables/BP_PL_Water_Well_Tier2.BP_PL_Water_Well_Tier2_C","/Game/Items/GatheringResources/Rock1.Rock1_C","None","1","0","BuildingItem","0.000000","0","None","OneHanded","","0","0","0","0","0.000000","0.000000","15.000000","0.000000","0.000000","0","0","0","0","0","0","0","0","0","0","0.000000","0.000000","0.000000","0.000000","0.000000","2","0.000000","0","0","0","0","Default","0","0","0","None","None","None","0","0","0","0.000000","0","-1.000000","16011","45","1","16021","45","1","14172","225","1","8","55","0","","","","","0","0","0.000000","1","0","None","-1"
80132,"NSLOCTEXT("""", ""73A23EAD4DFD82F20C43C5B5F86A7F13"", ""Large Water Well"")","NSLOCTEXT("""", ""C1C9701E43CE43B8BDEA97A3BFE76861"", ""A large well that fills slowly over time"")","NSLOCTEXT("""", ""23649877463FE02C417EBD9E29793A76"", ""Made from well-fitted, tight stonework, this well captures a generous amount of water.\nWater is an essential element for survival and this is doubly the case in the desert environments of the Exiled Lands. Any permanent settlement near water will inevitable be contested by others who also seek access to this life affirming resource.\nThe convenience of a well allows building in areas that would otherwise be unsustainable. Wells fill with water over time and can be used to quench thirst, replenish waterskins and perform the dozens of other activities that require the presence of water."")","/Game/UI/Textures/Icons/icon_t2_water_well.icon_t2_water_well","/Script/ConanSandbox.BuildingItem","/Game/Systems/Building/Placeables/BP_PL_Water_Well_Large.BP_PL_Water_Well_Large_C","/Game/Items/GatheringResources/Rock1.Rock1_C","None","1","0","BuildingItem","0.000000","0","None","OneHanded","","0","0","0","0","0.000000","0.000000","40.000000","0.000000","0.000000","0","0","0","0","0","0","0","0","0","0","0.000000","0.000000","0.000000","0.000000","0.000000","3","0.000000","0","0","0","0","Default","0","0","0","None","None","None","0","0","0","0.000000","0","-1.000000","16012","169","1","16021","150","1","16003","169","1","16","233","0","","","","","0","0","0.000000","1","0","None","-1"
80151,"NSLOCTEXT("""", ""1CBFE6244A59A806E12DFA9978744385"", ""Training Dummy"")","NSLOCTEXT("""", ""C63641094DB2ABBBCBEBB7868C3DDF73"", ""A training dummy for practising combat techniques"")","NSLOCTEXT("""", ""21D8028649E0D3DC6CE23EBDC107993C"", ""Made of stuffed straw and rough cloth, this dummy is a stand in for the horrendous creatures of the Exiled Lands.\nThe ability to guage hit locations from the markings on the dummy is a great way for warriors to increase their abilities."")","/Game/UI/Textures/Icons/icon_DEV_needs_icon.icon_DEV_needs_icon","/Script/ConanSandbox.BuildingItem","/Game/Systems/Building/Placeables/BP_PL_TargetDummy.BP_PL_TargetDummy_C","/Game/Items/GatheringResources/Rock1.Rock1_C","None","100","0","BuildingItem","0.000000","0","None","OneHanded","","0","0","0","0","0.000000","0.000000","5.000000","0.000000","0.000000","0","0","0","0","0","0","0","0","0","0","0.000000","0.000000","0.000000","0.000000","0.000000","2","0.000000","0","0","0","0","Default","0","0","0","None","None","None","0","0","0","0.000000","0","-1.000000","16011","8","1","16021","3","1","0","0","1","0","55","0","","","","","0","0","0.000000","5","0","None","-1"
80152,"NSLOCTEXT("""", ""CC8557C044E055999DC78AB4591DE9EC"", ""Archery Target"")","NSLOCTEXT("""", ""4D92A793420547B29E5A848DF587FF20"", ""A target for refining ranged techniques"")","NSLOCTEXT("""", ""364C95BB4D4715E3651818AC0B8D2A0D"", ""Bows require a lifetime of discipline to master and those who do not practise regularly will find themselves losing the edge.\nThis target provides a perfect opportunity to practise with bows, crossbows and thrown weapons without the inevitable conflict that comes from shooting somebody full of arrows."")","/Game/UI/Textures/Icons/icon_archery_target.icon_archery_target","/Script/ConanSandbox.BuildingItem","/Game/Systems/Building/Placeables/BP_PL_ArcheryTarget.BP_PL_ArcheryTarget_C","/Game/Items/GatheringResources/Rock1.Rock1_C","None","100","0","BuildingItem","0.000000","0","None","OneHanded","","0","0","0","0","0.000000","0.000000","5.000000","0.000000","0.000000","0","0","0","0","0","0","0","0","0","0","0.000000","0.000000","0.000000","0.000000","0.000000","2","0.000000","0","0","0","0","Default","0","0","0","None","None","None","0","0","0","0.000000","0","-1.000000","0","0","1","10001","38","1","12001","38","1","0","55","0","","","","","0","0","0.000000","1","0","None","-1"
80171,"NSLOCTEXT("""", ""E27A3964467975FB5AC1E9ADD1E73287"", ""Spike"")","NSLOCTEXT("""", ""DE00080A42ADEDC52E65CAB7E8BE8D2D"", ""This spike can be decorated with various skulls"")","NSLOCTEXT("""", ""DF26772B4609A300BB5967ABE74D43BE"", ""This sharpened wooden spike, once placed, waits patiently for something to be impaled upon it."")","/Game/UI/Textures/Icons/icon_spike.icon_spike","/Script/ConanSandbox.BuildingItem","/Game/Systems/Building/Placeables/BP_PL_Spike_1.BP_PL_Spike_1_C","/Game/Items/GatheringResources/Rock1.Rock1_C","None","100","0","BuildingItem","0.000000","0","None","OneHanded","","0","0","0","0","0.000000","0.000000","1.000000","0.000000","0.000000","0","0","0","0","0","0","0","0","0","0","0.000000","0.000000","0.000000","0.000000","0.000000","1","0.000000","0","0","0","0","Default","0","0","0","None","None","None","0","0","0","0.000000","0","-1.000000","0","0","1","0","0","1","0","0","1","0","1","0","","","","","0","0","0.000000","1","0","None","-1"
80201,"NSLOCTEXT("""", ""158492DF49FDEA7D8E2E3E977B40A77E"", ""Table"")","NSLOCTEXT("""", ""079EE8434D62FE764BCE6CBBA033FBB9"", ""A rectangular wooden table"")","NSLOCTEXT("""", ""C390F7614EB973B8C58DE29318A15CB4"", ""Tables vary in shape and size, materials and decoration based on the culture and craftsmanship of their maker.\nThis one is a wooden rectangle.\nThe artisan was probably hoping to decorate the table with dozens of interesting objects and thereby distract from the lack of imagination in the creation of the table itself."")","/Game/UI/Textures/Icons/icon_table_1.icon_table_1","/Script/ConanSandbox.BuildingItem","/Game/Systems/Building/Placeables/BP_PL_Table_1.BP_PL_Table_1_C","/Game/Items/GatheringResources/Rock1.Rock1_C","None","100","0","BuildingItem","0.000000","0","None","OneHanded","","0","0","0","0","0.000000","0.000000","2.000000","0.000000","0.000000","0","0","0","0","0","0","0","0","0","0","0.000000","0.000000","0.000000","0.000000","0.000000","1","0.000000","0","0","0","0","Default","0","0","0","None","None","None","0","0","0","0.000000","0","-1.000000","16021","3","1","0","0","1","0","0","1","0","5","0","","","","","0","0","0.000000","1","0","None","-1"
80202,"NSLOCTEXT("""", ""E3C2007E4A914646E90C059AC79FBED9"", ""Table - Round"")","NSLOCTEXT("""", ""24633046486DBDC5CEB99BA9BC0755F0"", ""A round wooden table"")","NSLOCTEXT("""", ""4F7D2CFF412204B8875309A58FE8CD67"", ""Tables vary in shape and size, materials and decoration based on the culture and craftsmanship of their maker.\nThis one is a wooden circle.\nThe artisan was probably hoping to decorate the table with dozens of interesting objects and thereby distract from the lack of imagination in the creation of the table itself."")","/Game/UI/Textures/Icons/icon_round_table.icon_round_table","/Script/ConanSandbox.BuildingItem","/Game/Systems/Building/Placeables/BP_PL_Table_2.BP_PL_Table_2_C","/Game/Items/GatheringResources/Rock1.Rock1_C","None","100","0","BuildingItem","0.000000","0","None","OneHanded","","0","0","0","0","0.000000","0.000000","2.000000","0.000000","0.000000","0","0","0","0","0","0","0","0","0","0","0.000000","0.000000","0.000000","0.000000","0.000000","1","0.000000","0","0","0","0","Default","0","0","0","None","None","None","0","0","0","0.000000","0","-1.000000","16021","3","1","0","0","1","0","0","1","0","5","0","","","","","0","0","0.000000","1","0","None","-1"
80210,"NSLOCTEXT("""", ""A5AB43EA42551703B1C07D9C48A2CFF8"", ""Simple Palisade"")","NSLOCTEXT("""", ""C8C0B81E496C682557B4B8911A98743F"", ""A bundle of sharpened stakes"")","NSLOCTEXT("""", ""CBBA26AD4A92C604905F1BA9D7B8455F"", ""These makeshift bundles of sharpened wooden stakes are usually placed around mercenary camps and other temporary fortifications.\nNo sane soldier wants to charge an enemy who has ringed their camp with barricades such as these."")","/Game/UI/Textures/Icons/icon_siege_palisade_1.icon_siege_palisade_1","/Script/ConanSandbox.BuildingItem","/Game/Systems/Building/Placeables/BP_PL_SimplePalisade.BP_PL_SimplePalisade_C","/Game/Items/GatheringResources/Rock1.Rock1_C","None","100","0","BuildingItem","0.000000","0","None","OneHanded","","0","0","0","0","0.000000","0.000000","1.000000","0.000000","0.000000","0","0","0","0","0","0","0","0","0","0","0.000000","0.000000","0.000000","0.000000","0.000000","2","0.000000","0","0","0","0","Default","0","0","0","None","None","None","0","0","0","0.000000","0","-1.000000","0","0","1","0","0","1","0","0","1","0","5","0","","","","","0","0","0.000000","1","0","None","-1"
80211,"NSLOCTEXT("""", ""275E5DF14EA0AAC8CFDA1BA61B827071"", ""Wall Palisade"")","NSLOCTEXT("""", ""FC62B7D24CB0E446A58DEA960A239DEF"", ""A barricade of high sharpened stakes"")","NSLOCTEXT("""", ""D13FBF3C47EDDC8CFB2BD380F7C96273"", ""Designed as a foil to cavalry charges, the stakes on these barricades were originally about chest high to a horse. Over time it was discovered that the closer the spikes were to eye height on a horse, the less chance that the beast could be coerced into charging them."")","/Game/UI/Textures/Icons/icon_siege_palisade_2.icon_siege_palisade_2","/Script/ConanSandbox.BuildingItem","/Game/Systems/Building/Placeables/BP_PL_WallPalisade.BP_PL_WallPalisade_C","/Game/Items/GatheringResources/Rock1.Rock1_C","None","100","0","BuildingItem","0.000000","0","None","OneHanded","","0","0","0","0","0.000000","0.000000","1.000000","0.000000","0.000000","0","0","0","0","0","0","0","0","0","0","0.000000","0.000000","0.000000","0.000000","0.000000","3","0.000000","0","0","0","0","Default","0","0","0","None","None","None","0","0","0","0.000000","0","-1.000000","0","0","1","0","0","1","0","0","1","0","5","0","","","","","0","0","0.000000","1","0","None","-1"
80251,"NSLOCTEXT("""", ""CAF0EF0F4B90FB5FD7290C8220C02114"", ""Square Stool"")","NSLOCTEXT("""", ""61DE55864A82AAED9F751FB1F58FA681"", ""A simple wooden stool"")","NSLOCTEXT("""", ""B2BFEC83491C5E03ACFBA6BFF8135CDA"", ""Sometimes after a day of killing and slaying, all an Exile wants to do is sit down and relax.\nStools are often used as makeshift weapons in tavern brawls across Hyboria, usually hurled at an opponent in between curses."")","/Game/UI/Textures/Icons/icon_stool_A.icon_stool_A","/Script/ConanSandbox.BuildingItem","/Game/Systems/Building/Placeables/BP_PL_Chair_Stool_Square.BP_PL_Chair_Stool_Square_C","/Game/Items/GatheringResources/Rock1.Rock1_C","None","100","0","BuildingItem","0.000000","0","None","OneHanded","","0","0","0","0","0.000000","0.000000","1.000000","0.000000","0.000000","0","0","0","0","0","0","0","0","0","0","0.000000","0.000000","0.000000","0.000000","0.000000","2","0.000000","0","0","0","0","Default","0","0","0","None","None","None","0","0","0","0.000000","0","-1.000000","16021","3","1","0","0","1","0","0","1","0","5","0","","","","","0","0","0.000000","1","0","None","-1"
80252,"NSLOCTEXT("""", ""C5E6A2954A595C9F9CB10B9C890C6848"", ""Round Stool"")","NSLOCTEXT("""", ""8B161C5B40B220B0BA969091F446F56E"", ""A round wooden stool"")","NSLOCTEXT("""", ""4CE4D5E14E3F87CC304E32ADC0CDE06D"", ""Useful for sitting and hurling at enemies."")","/Game/UI/Textures/Icons/icon_stool_B.icon_stool_B","/Script/ConanSandbox.BuildingItem","/Game/Systems/Building/Placeables/BP_PL_Chair_Stool_Round.BP_PL_Chair_Stool_Round_C","/Game/Items/GatheringResources/Rock1.Rock1_C","None","100","0","BuildingItem","0.000000","0","None","OneHanded","","0","0","0","0","0.000000","0.000000","1.000000","0.000000","0.000000","0","0","0","0","0","0","0","0","0","0","0.000000","0.000000","0.000000","0.000000","0.000000","2","0.000000","0","0","0","0","Default","0","0","0","None","None","None","0","0","0","0.000000","0","-1.000000","16021","3","1","0","0","1","0","0","1","0","5","0","","","","","0","0","0.000000","1","0","None","-1"
80253,"NSLOCTEXT("""", ""2503835646D7E65FFC004687354B3BCE"", ""Woven Stool"")","NSLOCTEXT("""", ""0B51A4984726D37DCEFE0D9C1E9BB777"", ""A woven wooden stool"")","NSLOCTEXT("""", ""1E6338BE47DA8B31A0B334BA980FD931"", ""Crafted by weaving thin bands of hard wood into a strong yet pliable surface, this stool is comfortable to sit on and very lightweight."")","/Game/UI/Textures/Icons/icon_stool_C.icon_stool_C","/Script/ConanSandbox.BuildingItem","/Game/Systems/Building/Placeables/BP_PL_Chair_Stool_Rectangular.BP_PL_Chair_Stool_Rectangular_C","/Game/Items/GatheringResources/Rock1.Rock1_C","None","100","0","BuildingItem","0.000000","0","None","OneHanded","","0","0","0","0","0.000000","0.000000","1.000000","0.000000","0.000000","0","0","0","0","0","0","0","0","0","0","0.000000","0.000000","0.000000","0.000000","0.000000","2","0.000000","0","0","0","0","Default","0","0","0","None","None","None","0","0","0","0.000000","0","-1.000000","16021","3","1","0","0","1","0","0","1","0","5","0","","","","","0","0","0.000000","1","0","None","-1"
80261,"NSLOCTEXT("""", ""BF9CCE9149C3D8B00BB0248588B34ABA"", ""Chair"")","NSLOCTEXT("""", ""BA0EEFC94EFA64F9487956952B32BFB1"", ""A wooden chair"")","NSLOCTEXT("""", ""E14EDFBA47649D1872675DBD711A4B21"", ""Commonly found only in the houses of the wealthy or noble, chairs with armrests and backs are considered a mark of refinement."")","/Game/UI/Textures/Icons/icon_chair_2.icon_chair_2","/Script/ConanSandbox.BuildingItem","/Game/Systems/Building/Placeables/BP_PL_Chair_1.BP_PL_Chair_1_C","/Game/Items/GatheringResources/Rock1.Rock1_C","None","100","0","BuildingItem","0.000000","0","None","OneHanded","","0","0","0","0","0.000000","0.000000","1.000000","0.000000","0.000000","0","0","0","0","0","0","0","0","0","0","0.000000","0.000000","0.000000","0.000000","0.000000","2","0.000000","0","0","0","0","Default","0","0","0","None","None","None","0","0","0","0.000000","0","-1.000000","16021","3","1","0","0","1","0","0","1","0","5","0","","","","","0","0","0.000000","1","0","None","-1"
80271,"NSLOCTEXT("""", ""A39E02154AC92ACF46F40FB76026F052"", ""Log Bench"")","NSLOCTEXT("""", ""1FA830AB44C777E824738C986AAD8C34"", ""A crude log bench"")","NSLOCTEXT("""", ""A378B7D44F611480332BD980CEA920AE"", ""Benches like this are common in the taverns and alehouses of the world. "")","/Game/UI/Textures/Icons/icon_log_bench.icon_log_bench","/Script/ConanSandbox.BuildingItem","/Game/Systems/Building/Placeables/BP_PL_LogBench.BP_PL_LogBench_C","/Game/Items/GatheringResources/Rock1.Rock1_C","None","100","0","BuildingItem","0.000000","0","None","OneHanded","","0","0","0","0","0.000000","0.000000","2.000000","0.000000","0.000000","0","0","0","0","0","0","0","0","0","0","0.000000","0.000000","0.000000","0.000000","0.000000","2","0.000000","0","0","0","0","Default","0","0","0","None","None","None","0","0","0","0.000000","0","-1.000000","16021","3","1","0","0","1","0","0","1","0","5","0","","","","","0","0","0.000000","1","0","None","-1"
80281,"NSLOCTEXT("""", ""C94A47EC456698EF47652EB647CEDB01"", ""Stone Throne"")","NSLOCTEXT("""", ""554B1063404652373D1744A3AACD2FCD"", ""A throne made of stone"")","NSLOCTEXT("""", ""CD68D68142B230840B8E62A0EA68C2EE"", ""Unlike other chairs, a throne gives the one who sits in it authority above and beyond that of an ordinary man.\nBattles have always been fought for this kind of power, and they always will be.\nSitting on a throne of any kind will increase confidence and prowess for a period."")","/Game/UI/Textures/Icons/icon_throne.icon_throne","/Script/ConanSandbox.BuildingItem","/Game/Systems/Building/Placeables/BP_PL_Chair_Throne.BP_PL_Chair_Throne_C","/Game/Items/GatheringResources/Rock1.Rock1_C","None","100","0","BuildingItem","0.000000","0","None","OneHanded","","0","0","0","0","0.000000","0.000000","10.000000","0.000000","0.000000","0","0","0","0","0","0","0","0","0","0","0.000000","0.000000","0.000000","0.000000","0.000000","3","0.000000","0","0","0","0","Default","0","0","0","None","None","None","0","0","0","0.000000","0","-1.000000","16012","68","1","16003","14","1","0","0","1","0","233","0","","","","","0","0","0.000000","1","0","None","-1"
80301,"NSLOCTEXT("""", ""D349C80B42FB01ADE6AF1197A33EBDE9"", ""Wooden Signpost"")","NSLOCTEXT("""", ""FD921B734102EE559FAC1EAE5BB207FE"", ""A wooden signpost"")","NSLOCTEXT("""", ""70A4DFC744886560E41A9182FD496965"", ""In the Western kingdoms of Aquilonia and Nemedia, the practise of using wooden signs to provide warning and information for travellers and merchants has been established for centuries.\nOnce a signpost is placed, it can be used to write a custom message for any travellers to read."")","/Game/UI/Textures/Icons/icon_signpost_large.icon_signpost_large","/Script/ConanSandbox.BuildingItem","/Game/Systems/Building/Placeables/BP_PL_Signpost.BP_PL_Signpost_C","/Game/Items/GatheringResources/Rock1.Rock1_C","None","100","0","BuildingItem","0.000000","0","None","OneHanded","","0","0","0","0","0.000000","0.000000","1.000000","0.000000","0.000000","0","0","0","0","0","0","0","0","0","0","0.000000","0.000000","0.000000","0.000000","0.000000","2","0.000000","0","0","0","0","Default","0","0","0","None","None","None","0","0","0","0.000000","0","-1.000000","0","0","1","16021","1","1","0","0","1","0","5","0","","","","","0","0","0.000000","1","0","None","-1"
80302,"NSLOCTEXT("""", ""5E829EAB49C4D9818D6BC1B9B9ABD4E3"", ""Wall Sign"")","NSLOCTEXT("""", ""5E170D6543A6E2A53873CF84CD66CC58"", ""A wall sign"")","NSLOCTEXT("""", ""53A9F20547FFE51F6FBB9D95628756D5"", ""Designed to be placed on walls and provide information about the location, these signs are a mark of civilization beyond what most people would expect to find in the Exiled Lands.\nOnce a signpost is placed, it can be used to write a custom message for any travellers to read."")","/Game/UI/Textures/Icons/icon_wall_sign.icon_wall_sign","/Script/ConanSandbox.BuildingItem","/Game/Systems/Building/Placeables/BP_PL_WallSign.BP_PL_WallSign_C","/Game/Items/GatheringResources/Rock1.Rock1_C","None","100","0","BuildingItem","0.000000","0","None","OneHanded","","0","0","0","0","0.000000","0.000000","1.000000","0.000000","0.000000","0","0","0","0","0","0","0","0","0","0","0.000000","0.000000","0.000000","0.000000","0.000000","2","0.000000","0","0","0","0","Default","0","0","0","None","None","None","0","0","0","0.000000","0","-1.000000","0","0","1","16021","1","1","0","0","1","0","5","0","","","","","0","0","0.000000","1","0","None","-1"
80311,"NSLOCTEXT("""", ""A308DCCE4682FCBE73503692D04847CD"", ""Papyrus Scroll"")","NSLOCTEXT("""", ""C6CEA6D44F497C39FCB42CBD67AF66E7"", ""A scroll made from flattened reed stalks"")","NSLOCTEXT("""", ""DD1F332B43C4FAD8FBCF9DB8A32F3C68"", ""Made from the pith of flattened reeds, papyrus scrolls are commonly used in Stygia for holding the words of sacred texts.\nThe material used is too brittle to be very good for the creation of long-form texts, but for simple messages a papyrus scroll is cheap and easy to produce.\nThis scroll can be filled in, and then shared with others. If they can read, of course. "")","/Game/UI/Textures/Icons/icon_papyrus_scroll.icon_papyrus_scroll","/Script/ConanSandbox.BuildingItem","/Game/Systems/Building/Placeables/BP_PL_DefaultPlaceable.BP_PL_DefaultPlaceable_C","/Game/Items/GatheringResources/Rock1.Rock1_C","None","100","0","BuildingItem","0.000000","0","None","OneHanded","","0","0","0","0","0.000000","0.000000","1.000000","0.000000","0.000000","0","0","0","0","0","0","0","0","0","0","0.000000","0.000000","0.000000","0.000000","0.000000","1","0.000000","0","0","0","0","Default","0","0","0","None","None","None","0","0","0","0.000000","0","-1.000000","12001","38","1","0","0","1","0","0","1","0","5","0","","","","","0","0","0.000000","1","0","None","-1"
