51822,"NSLOCTEXT("""", ""6078F17B491D13A7062BFC8069760F35"", ""Cutlass"")","NSLOCTEXT("""", ""FBDEB06645401D79E05E709AF542D4F5"", ""A slashing weapon favoured by pirates"")","NSLOCTEXT("""", ""2F3AB9634F77BE0AE211A3941DAA61AE"", ""<span style=\""italic\""> At this kind of fighting the freebooters of the sea were at their stoutest; their arrows and bolts tore holes in the charging horde, their cutlasses hewed the wild men from the palisades they strove to scale.</>\nThe Black Stranger\n\nFavoured by sailors from the Western ocean to the Vilayet, the cutlass is a short, curved sword capable of hacking through ropes, canvas, wood, and flesh.\nForged of cheap iron, cutlasses are usually splotched with rust due to their time spent near salt water. \nThis cutlass does not bear any markers of origin."")","/Game/UI/Textures/Icons/icon_cutlass.icon_cutlass","/Game/Items/BPGameItemWeapon.BPGameItemWeapon_C","None","/Game/Items/Weapons/Sword1h/sword1h.sword1h_C","None","1","1","Weapon","0.000000","9","Sword","OneHanded","","2","3","0","0","0.000000","1.000000","2.310000","35.000000","250.000000","45","57","0","0","0","0","0","0","1","33","180.000000","1.000000","0.000000","0.000000","0.000000","3","0.144000","0","0","0","0","Iron","30","60","0","/Game/Items/Weapons/Sword1h/SM_1h_edge_sword_cutlass_steel.SM_1h_edge_sword_cutlass_steel","None","/Game/Items/Weapons/Sword1h/SM_1h_edge_sword_cutlass_steel_DM.SM_1h_edge_sword_cutlass_steel_DM","0","0","0","0.000000","0","220.000000","0","0","1","11501","15","1","0","0","1","0","0","0","NSLOCTEXT("""", ""87339E7A4D89832F41B4D6B36F01A14F"", ""Mid Grade"")","NSLOCTEXT("""", ""AF53CAED40000449CCF2499864997394"", ""Weapon"")","","","0","0","0.000000","1","0","None","-1"
51823,"NSLOCTEXT("""", ""17209588418765B20923018D9CF68291"", ""Exceptional Cutlass"")","NSLOCTEXT("""", ""99693790496692E5713FD3BC71CA7D8A"", ""A slashing weapon favoured by pirates"")","NSLOCTEXT("""", ""E2020D39415824B3AB5ED29A44959A19"", ""<span style=\""italic\""> At this kind of fighting the freebooters of the sea were at their stoutest; their arrows and bolts tore holes in the charging horde, their cutlasses hewed the wild men from the palisades they strove to scale.</>\nThe Black Stranger\n\nFavoured by sailors from the Western ocean to the Vilayet, the cutlass is a short, curved sword capable of hacking through ropes, canvas, wood, and flesh.\nForged of cheap iron, cutlasses are usually splotched with rust due to their time spent near salt water. \nThis cutlass does not bear any markers of origin."")","/Game/UI/Textures/Icons/icon_cutlass.icon_cutlass","/Game/Items/BPGameItemWeapon.BPGameItemWeapon_C","None","/Game/Items/Weapons/Sword1h/sword1h.sword1h_C","None","1","1","Weapon","0.000000","9","Sword","OneHanded","","2","3","0","0","0.000000","1.000000","2.100000","35.000000","250.000000","49","61","0","0","0","0","0","0","1","33","180.000000","1.000000","0.000000","0.000000","0.000000","3","0.144000","0","0","0","0","Iron","30","60","0","/Game/Items/Weapons/Sword1h/SM_1h_edge_sword_cutlass_steel.SM_1h_edge_sword_cutlass_steel","None","/Game/Items/Weapons/Sword1h/SM_1h_edge_sword_cutlass_steel_DM.SM_1h_edge_sword_cutlass_steel_DM","0","0","0","0.000000","0","255.000000","0","0","1","11501","15","1","0","0","1","0","0","0","NSLOCTEXT("""", ""411F142D4AF3000FE98C92B5C5802475"", ""High Grade"")","NSLOCTEXT("""", ""4D01DC03411A0FE3895D6D8661010FA6"", ""Weapon"")","","","0","0","0.000000","1","0","None","-1"
51831,"NSLOCTEXT("""", ""F490009443A37E5787C8DB8A688A6648"", ""Longsword"")","NSLOCTEXT("""", ""367EB3184CBF5A41CFC23895BC3A680E"", ""A common, thin bladed, double-edged sword"")","NSLOCTEXT("""", ""94DA73ED4BF4D344FEB0FC83EACBCC91"", ""<span style=\""italic\""> They stopped short. Conan faced them, not a naked man roused mazed and unarmed out of deep sleep to be butchered like a sheep, but a barbarian wide-awake and at bay, partly armored, and with his long sword in his hand.</>\nThe Phoenix on the Sword\n\nLongsword has become a catch-all phrase for the mongrel swords of a thousand different makes that don?t align easily with one simple classification.\nThe only description of a longsword that seems to be agreed upon is that they are double-bladed and straight. Beyond that they vary wildly from grooved blades to smooth blades, long hilts to short hilts, one-handed and two-handed variations.\nThis example is plain, straight and intended to be wielded in a single hand."")","/Game/UI/Textures/Icons/icon_longsword.icon_longsword","/Game/Items/BPGameItemWeapon.BPGameItemWeapon_C","None","/Game/Items/Weapons/Sword1h/sword1h.sword1h_C","None","1","1","Weapon","0.000000","9","Sword","OneHanded","","2","3","0","0","0.000000","1.000000","1.750000","35.000000","250.000000","60","76","0","0","0","0","0","0","1","33","180.000000","1.000000","0.000000","0.000000","0.000000","3","0.162000","0","0","0","0","Steel","30","60","0","/Game/Items/Weapons/Sword1h/SM_1h_exile_longsword.SM_1h_exile_longsword","None","/Game/Items/Weapons/Sword1h/SM_1h_exile_longsword_DM.SM_1h_exile_longsword_DM","0","0","0","0.000000","0","350.000000","0","0","1","11502","15","1","0","0","1","0","0","0","NSLOCTEXT("""", ""CC696F534205D94061A20BABFC605735"", ""High Grade"")","NSLOCTEXT("""", ""FC7A7EF9466BCD72956CD886774F8AD1"", ""Weapon"")","","","0","0","0.000000","1","0","None","-1"
51832,"NSLOCTEXT("""", ""378948D345BEEE339C0DF5ADF1947B6A"", ""Dry Scraper"")","NSLOCTEXT("""", ""A5CE4F724E01B54FDFFE3E91FC8FF62E"", ""A razor sharp tool for scraping hides"")","NSLOCTEXT("""", ""0938C35747051BD8A07D10AF649652A8"", ""<span style=\""italic\"">But a bat has flown over the Mountains of the Dead and drawn your image in blood on the white tiger\'s hide that hangs before the long hut where sleep the Four Brothers of the Night.</> - Beyond the Black River\n\nBefore preparation, hides must be scraped to remove excess fibres and clots of skin. The best hide scrapers are sharp, easy to weild and leave a smooth line of transition so that it is easy to see which part of the hide still requires treatment."")","/Game/UI/Textures/Icons/icon_thrall_scrape.icon_thrall_scrape","/Game/Items/BPGameItemWeapon.BPGameItemWeapon_C","None","/Game/Items/Weapons/Sword1h/sword1h.sword1h_C","None","1","1","Weapon","0.000000","9","Sword","OneHanded","","1","0","0","0","0.000000","1.000000","1.540000","35.000000","250.000000","28","35","0","0","0","0","0","0","1","33","180.000000","1.000000","0.000000","0.000000","0.000000","1","0.108000","0","0","0","0","Stone","30","60","0","/Game/Items/Weapons/Thralls/Thrall_scrape/SM_1h_thrall_scrape_01.SM_1h_thrall_scrape_01","None","/Game/Items/Weapons/Thralls/Thrall_scrape/SM_1h_thrall_scrape_01_DM.SM_1h_thrall_scrape_01_DM","0","0","0","0.000000","0","160.000000","0","0","1","11501","15","1","0","0","1","0","0","0","NSLOCTEXT("""", ""E9F02FAF47926979BBD5A5926FC9EDF6"", ""Mid Grade"")","NSLOCTEXT("""", ""C1FFA2EE4D042C505D97118F3E47A475"", ""Weapon"")","","","0","0","0.000000","1","0","None","-1"
51833,"NSLOCTEXT("""", ""0DFBA0B24D77CA3060ABA891D1A71379"", ""Darfari Axe"")","","","/Game/UI/Textures/Icons/icon_yog_cleaver.icon_yog_cleaver","/Game/Items/BPGameItemWeapon.BPGameItemWeapon_C","None","/Game/Items/Weapons/Axe/BP_Axe.BP_Axe_C","None","1","1","Weapon","0.000000","9","Axe","OneHanded","","2","2","0","0","0.000000","1.000000","1.730000","35.000000","250.000000","35","50","0","0","0","0","0","0","1","33","180.000000","1.000000","0.000000","0.000000","0.000000","1","0.240000","0","0","0","0","Stone","30","60","0","/Game/Items/Weapons/Axe/SM_1h_axe_yog.SM_1h_axe_yog","None","/Game/Items/Weapons/Axe/SM_1h_axe_yog_DM.SM_1h_axe_yog_DM","0","0","0","0.000000","0","50.000000","0","0","1","10001","15","1","0","0","1","0","0","0","NSLOCTEXT("""", ""8444A04945708E34E7EADC956072969A"", ""High Grade"")","NSLOCTEXT("""", ""4F82179F43E2BB6E5BF57BADC43CAC60"", ""Weapon"")","","","0","0","0.000000","1","0","None","-1"
51834,"NSLOCTEXT("""", ""BF3A7F8B4EF95F9C4F996C936CC1E382"", ""El\'s Drinker"")","NSLOCTEXT("""", ""2C7C0F2E458E21FEB210E8916C424BD5"", ""A sword of blackest ebony"")","NSLOCTEXT("""", ""76BDD35C4EECBAB37C364AA92DFD105F"", ""The origins of this blade are mysteriously absent from any record. Those who have possessed it over the years claim that it fills them with a nameless hunger for blood.\nOnce the sword was taken to oracle who named it a dark spirit that \""crosses between worlds and time endlessly, in search of shattered men in shattered lands who will let it drink\""."")","/Game/UI/Textures/Icons/icon_longsword.icon_longsword","/Game/Items/BPGameItemWeapon.BPGameItemWeapon_C","None","/Game/Items/Weapons/Sword1h/sword1h.sword1h_C","None","1","1","Weapon","0.000000","9","Sword","OneHanded","","2","3","0","0","0.000000","1.000000","1.400000","35.000000","250.000000","68","85","0","0","0","0","0","0","1","33","180.000000","1.000000","0.000000","0.000000","0.000000","3","0.162000","0","0","0","0","Iron","30","60","0","/Game/Items/Weapons/Sword1h/SM_1h_exile_longsword.SM_1h_exile_longsword","None","/Game/Items/Weapons/Sword1h/SM_1h_exile_longsword_DM.SM_1h_exile_longsword_DM","0","0","0","0.000000","0","410.000000","0","0","1","0","0","1","0","0","1","0","0","0","NSLOCTEXT("""", ""96AFEB5F43724ADEA923DDA9CE61E49B"", ""High Grade"")","NSLOCTEXT("""", ""666C32FE4AFF28B4EBB365B8D7351BB4"", ""Weapon"")","","","0","0","0.000000","1","0","None","-1"
51835,"NSLOCTEXT("""", ""99359E9147C9AC259D599FAD538223AC"", ""Tulwar of Amir Khurum"")","NSLOCTEXT("""", ""A9DC6C5D448FC65C27DB1C9EE89DCA49"", ""Legendary tulwar of a Wazuli Chief"")","NSLOCTEXT("""", ""FB8524BF4237117BB7A834B770C3DB12"", ""<span style=\""italic\""> Conan lifted his knife and smote, and the watchers were dumbfounded to see his blow checked apparently in midair, with the loud clang of steel that meets an unyielding substance. He wasted no more effort. He knew that not even the legendary tulwar of Amir Khurum could shatter that invisible curtain.</>\nThe People of the Black Circle\n\nAmir Khurum was a legendary prince and commander of the Wazuli tribe. The Wazuli revere his memory for his even-handed nature as a chief - he dealt honorably with all and led them to a great deal of treasure in his career.\nIf the legends are to be believer, this tulwar can pass through any armor, though it is hard to say if this is the original item or an elaborate forgery."")","/Game/UI/Textures/Icons/icon_longsword.icon_longsword","/Game/Items/BPGameItemWeapon.BPGameItemWeapon_C","None","/Game/Items/Weapons/Sword1h/sword1h.sword1h_C","None","1","1","Weapon","0.000000","9","Sword","OneHanded","","2","3","0","0","0.000000","1.000000","1.400000","35.000000","250.000000","68","85","0","0","0","0","0","0","1","33","180.000000","1.000000","0.000000","0.000000","0.000000","3","0.162000","0","0","0","0","Iron","30","60","0","/Game/Items/Weapons/Sword1h/SM_1h_edge_sword_cutlass_steel.SM_1h_edge_sword_cutlass_steel","None","/Game/Items/Weapons/Sword1h/SM_1h_edge_sword_cutlass_steel_DM.SM_1h_edge_sword_cutlass_steel_DM","0","0","0","0.000000","0","410.000000","0","0","1","0","0","1","0","0","1","0","0","0","NSLOCTEXT("""", ""C76F6F0C42FA57C9EC0400A277F2E6EE"", ""High Grade"")","NSLOCTEXT("""", ""6B07A48645EFDD4D17DA2A844874AE82"", ""Weapon"")","","","0","0","0.000000","1","0","None","-1"
51836,"NSLOCTEXT("""", ""FD7EB8F440324862B9E582BE26F8C625"", ""Exceptional Longsword"")","NSLOCTEXT("""", ""A3D2EAD64345E683B9748AA740257AC1"", ""A common, thin bladed, double-edged sword"")","NSLOCTEXT("""", ""3704C6DA45513B26C63A13ACBD991B70"", ""<span style=\""italic\""> They stopped short. Conan faced them, not a naked man roused mazed and unarmed out of deep sleep to be butchered like a sheep, but a barbarian wide-awake and at bay, partly armored, and with his long sword in his hand.</>\nThe Phoenix on the Sword\n\nLongsword has become a catch-all phrase for the mongrel swords of a thousand different makes that don?t align easily with one simple classification.\nThe only description of a longsword that seems to be agreed upon is that they are double-bladed and straight. Beyond that they vary wildly from grooved blades to smooth blades, long hilts to short hilts, one-handed and two-handed variations.\nThis example is plain, straight and intended to be wielded in a single hand."")","/Game/UI/Textures/Icons/icon_longsword.icon_longsword","/Game/Items/BPGameItemWeapon.BPGameItemWeapon_C","None","/Game/Items/Weapons/Sword1h/sword1h.sword1h_C","None","1","1","Weapon","0.000000","9","Sword","OneHanded","","2","3","0","0","0.000000","1.000000","1.580000","35.000000","250.000000","64","80","0","0","0","0","0","0","1","33","180.000000","1.000000","0.000000","0.000000","0.000000","3","0.162000","0","0","0","0","Steel","30","60","0","/Game/Items/Weapons/Sword1h/SM_1h_exile_longsword.SM_1h_exile_longsword","None","/Game/Items/Weapons/Sword1h/SM_1h_exile_longsword_DM.SM_1h_exile_longsword_DM","0","0","0","0.000000","0","380.000000","0","0","1","11502","15","1","0","0","1","0","0","0","NSLOCTEXT("""", ""142C506F42471A3A4E1FD8BC168AF5F6"", ""High Grade"")","NSLOCTEXT("""", ""49A97B8C486FCC67BA4044ADAAE33C42"", ""Weapon"")","","","0","0","0.000000","1","0","None","-1"
51837,"NSLOCTEXT("""", ""2C81369C44AE0DE287B1D4864829B5A4"", ""Flawless Longsword"")","NSLOCTEXT("""", ""1D88BB774549DC4C53E9F6B5DB9A7EFF"", ""A common, thin bladed, double-edged sword"")","NSLOCTEXT("""", ""D35FCE824ED00253DE9DED8F8D6D3BF3"", ""<span style=\""italic\""> They stopped short. Conan faced them, not a naked man roused mazed and unarmed out of deep sleep to be butchered like a sheep, but a barbarian wide-awake and at bay, partly armored, and with his long sword in his hand.</>\nThe Phoenix on the Sword\n\nLongsword has become a catch-all phrase for the mongrel swords of a thousand different makes that don?t align easily with one simple classification.\nThe only description of a longsword that seems to be agreed upon is that they are double-bladed and straight. Beyond that they vary wildly from grooved blades to smooth blades, long hilts to short hilts, one-handed and two-handed variations.\nThis example is plain, straight and intended to be wielded in a single hand."")","/Game/UI/Textures/Icons/icon_longsword.icon_longsword","/Game/Items/BPGameItemWeapon.BPGameItemWeapon_C","None","/Game/Items/Weapons/Sword1h/sword1h.sword1h_C","None","1","1","Weapon","0.000000","9","Sword","OneHanded","","2","3","0","0","0.000000","1.000000","1.400000","35.000000","250.000000","68","85","0","0","0","0","0","0","1","33","180.000000","1.000000","0.000000","0.000000","0.000000","3","0.162000","0","0","0","0","Steel","30","60","0","/Game/Items/Weapons/Sword1h/SM_1h_exile_longsword.SM_1h_exile_longsword","None","/Game/Items/Weapons/Sword1h/SM_1h_exile_longsword_DM.SM_1h_exile_longsword_DM","0","0","0","0.000000","0","410.000000","0","0","1","11502","15","1","0","0","1","0","0","0","NSLOCTEXT("""", ""29197C764F6813ABD56882971E11F4F0"", ""High Grade"")","NSLOCTEXT("""", ""5AF7974C4D86C3E4D2201D8D14DE5EE9"", ""Weapon"")","","","0","0","0.000000","1","0","None","-1"
51850,"NSLOCTEXT("""", ""E8A2ACB64631E95D9A7E4F83F4CAB1A0"", ""Darfari Cudgel"")","","","/Game/UI/Textures/Icons/icon_darfari_bone_club.icon_darfari_bone_club","/Game/Items/BPGameItemWeapon.BPGameItemWeapon_C","None","/Game/Items/Weapons/Club/BP_club_1h.BP_club_1h_C","None","1","1","Weapon","0.000000","9","Axe","OneHanded","","2","2","0","0","0.000000","1.000000","1.730000","35.000000","250.000000","35","50","0","0","0","0","0","0","1","33","180.000000","1.000000","0.000000","0.000000","0.000000","1","0.240000","0","0","0","0","Stone","30","60","0","/Game/Items/Weapons/Club/SM_Club_yog.SM_Club_yog","None","/Game/Items/Weapons/Club/SM_Club_yog_DM.SM_Club_yog_DM","0","0","0","0.000000","0","50.000000","0","0","1","10001","30","1","0","0","1","0","0","0","NSLOCTEXT("""", ""07E5C37F4A5147646AA94D86876BB28A"", ""Low Grade"")","NSLOCTEXT("""", ""C684438D462467A87C8FBB81E866407B"", ""Weapon"")","","","0","0","0.000000","1","0","None","-1"
51851,"NSLOCTEXT("""", ""D67147A342C4BF02E7CF6A87257C6DFA"", ""Cimmerian Battle-axe"")","NSLOCTEXT("""", ""BC1C5E9446604996F5A9D4A1718166E8"", ""A vicious, double bladed steel axe"")","NSLOCTEXT("""", ""4FB31FC54B0B13294CEC9BB51F033938"", ""<span style=\""italic\""> He did not wonder at the strangeness of it all, not even when two gigantic figures rose up to bar his way. The scales of their mail were white with hoar-frost; their helmets and their axes were covered with ice.</>\nThe Frost Giant?s Daughter\n\nShaped of steel and marked with the swirling markings of a Cimmerian clan, this battle-axe is sharp, durable and capable of inflicting vicious wounds.\nBattle-axes are a difficult weapon for inexperienced warriors, due to their smaller surface area and uneven balance. No other one-handed weapon shares their raw power, however, and they can wreak havoc on unarmored foes.\nCimmerian clans often engage in violent local conflict and the battle-axe is a preferred weapon for breaching the wood-walled settlements and laying waste to the rival clansmen within.\n"")","/Game/UI/Textures/Icons/icon_cimmerian_battleaxe.icon_cimmerian_battleaxe","/Game/Items/BPGameItemWeapon.BPGameItemWeapon_C","None","/Game/Items/Weapons/Sword1h/sword1h.sword1h_C","None","1","1","Weapon","0.000000","9","Axe","OneHanded","","2","3","0","0","0.000000","1.000000","1.750000","35.000000","250.000000","57","72","0","0","0","0","0","0","1","33","180.000000","1.000000","0.000000","0.000000","0.000000","3","0.162000","0","0","0","0","Steel","30","60","0","/Game/Items/Weapons/Axe/SM_1h_axe_cimmerian_battleaxe_ornamented_steel.SM_1h_axe_cimmerian_battleaxe_ornamented_steel","None","/Game/Items/Weapons/Axe/SM_1h_axe_cimmerian_battleaxe_ornamented_steel_DM.SM_1h_axe_cimmerian_battleaxe_ornamented_steel_DM","0","0","0","0.000000","0","315.000000","0","0","1","11502","15","1","0","0","1","0","0","0","NSLOCTEXT("""", ""DC4D19C64C5DF993720EAD8AC7628D94"", ""Mid Grade"")","NSLOCTEXT("""", ""B1F9935F47AC52BAD5E023932942B593"", ""Weapon"")","","","0","0","0.000000","1","0","None","-1"
51853,"NSLOCTEXT("""", ""71C2D25641CEF4E9CD1707B7931F1957"", ""Darfari Sword"")","NSLOCTEXT("""", ""DD5A102B47B07A13CAB3BAAD309E6BAA"", ""A tooth-edged sword of bone"")","NSLOCTEXT("""", ""634A0F5C4C93222E01128CB8818B09DA"", ""<span style=\""italic\"">With an awful shriek the witch sank down, writhing in convulsions, grasping at the naked blade as it was withdrawn, smoking and dripping.</> - A Witch Shall Be Born\nA mark of the Darfari wish to emulate more advanced cultures, this \""sword\"" is more like a flat plank embedded with the teeth of various animals. It swings like a plank as well, so while it may not have the lethality of a well whetted blade, it will still leave a nasty mark on anything it managed to hit."")","/Game/UI/Textures/Icons/icon_darfari_bone_sword.icon_darfari_bone_sword","/Game/Items/BPGameItemWeapon.BPGameItemWeapon_C","None","/Game/Items/Weapons/Sword1h/sword1h.sword1h_C","None","1","1","Weapon","0.000000","9","Axe","OneHanded","","2","2","0","0","0.000000","1.000000","1.730000","35.000000","250.000000","26","33","0","0","0","0","0","0","1","33","180.000000","1.000000","0.000000","0.000000","0.000000","2","0.144000","0","0","0","0","Stone","30","60","0","/Game/Items/Weapons/Sword1h/SM_1h_sword_dofari_bone.SM_1h_sword_dofari_bone","None","/Game/Items/Weapons/Sword1h/SM_1h_sword_dofari_bone_DM.SM_1h_sword_dofari_bone_DM","0","0","0","0.000000","0","50.000000","0","0","1","10021","23","1","0","0","1","0","0","0","NSLOCTEXT("""", ""CA1587474065E125339EE6BE1D600BCF"", ""Low Grade"")","NSLOCTEXT("""", ""2246FCB943058D08A4A02F8EA740D6A7"", ""Weapon"")","","","0","0","0.000000","1","0","None","-1"
51854,"NSLOCTEXT("""", ""5F71AE4C4C5832EB79021A8B9E1D6ACB"", ""Yog Cleaver"")","NSLOCTEXT("""", ""6F04E68F40BCA0000DC3978979DA5C12"", ""A rudimentary axe created from a jawbone bound to a stout branch"")","NSLOCTEXT("""", ""3ACF7CB4448F3F2AA43156A713EDCE98"", ""<span style=\""italic\""> On the heels of the shout came a clamor of blood-freezing screams, the shattering impact of axes on the gate.</> \nThe Black Stranger\n\nBladed weapons are generally frowned upon by the worshippers of Yog, but this jawbone is dull enough that it acts more like a club than a sword.\nYoggites believe that the consumption of human flesh gives them the Blessing of Yog for a period of time, which grants them invulnerability to normal weapons.\nWhile Yog is considered a deity in Darfar, scholars in Hyboria classify him as a demon of the Elder night, referencing ancient documents that survived the drowning of Atlantis."")","/Game/UI/Textures/Icons/icon_darfari_bone_club.icon_darfari_bone_club","/Game/Items/BPGameItemWeapon.BPGameItemWeapon_C","None","/Game/Items/Weapons/Club/BP_club_1h.BP_club_1h_C","None","1","1","Weapon","0.000000","9","YogTool","OneHanded","","2","2","0","0","0.000000","1.000000","1.730000","35.000000","250.000000","26","33","0","0","0","0","0","0","1","33","180.000000","1.000000","0.000000","0.000000","0.000000","1","0.144000","0","0","0","0","Stone","30","60","0","/Game/Items/Weapons/Club/SM_1h_darfari_bone_club.SM_1h_darfari_bone_club","None","/Game/Items/Weapons/Club/SM_1h_darfari_bone_club_DM.SM_1h_darfari_bone_club_DM","0","0","0","0.000000","0","50.000000","0","0","1","10021","23","1","0","0","1","0","0","0","NSLOCTEXT("""", ""EE898A814EC56E9C189010831DCC5655"", ""Low Grade"")","NSLOCTEXT("""", ""911E0ED547B9B5C8BC49EAB729BA9909"", ""Weapon"")","","","0","0","0.000000","1","0","None","-1"
51855,"NSLOCTEXT("""", ""4CED7DAE4CB58C5AD05AADA801486714"", ""Yoggite Cudgel"")","NSLOCTEXT("""", ""BD2D91684843B4C9FD5131B2DD385DFF"", ""A macabre weapon of bone fused to rock"")","NSLOCTEXT("""", ""88FC9AB94706F3906E26BA98464441C3"", ""<span style=\""italic\""> He wondered how many poor devils had been bludgeoned in their sleep and dragged out of that room and down the road that ran through the shadowed palm groves to the roasting pit.</>  ? Shadows in Zamboula\nThis sinister weapon is made of the bones of a human arm bound to a large fragment of stone. \nCannibalism is more than a perverted appetite to the men of Darfar: it is an integral element of their cult. This cudgel is one of the ritual objects of the Yoggite religion. It is used to bludgeon human prey so that they can be carried to the sacrifice pit unblemished.\nBone is a brittle substance that breaks easily under even a small amount of force. Anything made of bone will fall apart quickly."")","/Game/UI/Textures/Icons/icon_yog_cudgel.icon_yog_cudgel","/Game/Items/BPGameItemWeapon.BPGameItemWeapon_C","None","/Game/Items/Weapons/Club/BP_club_1h.BP_club_1h_C","None","1","1","Weapon","0.000000","9","Axe","OneHanded","","2","2","0","0","0.000000","1.000000","1.730000","35.000000","250.000000","53","75","0","0","0","0","0","0","1","33","180.000000","1.000000","0.000000","0.000000","0.000000","3","0.240000","0","0","0","0","Stone","30","60","0","/Game/Items/Weapons/Club/SM_Club_yog_god.SM_Club_yog_god","None","/Game/Items/Weapons/Club/SM_Club_yog_god_DM.SM_Club_yog_god_DM","0","0","0","0.000000","0","100.000000","0","0","1","10001","15","1","15002","15","1","0","0","0","NSLOCTEXT("""", ""BD644A7641C49596622AD281D6EE23D1"", ""High Grade"")","NSLOCTEXT("""", ""C997719740BA7D5ED3C29CAC11930383"", ""Weapon"")","","","0","0","0.000000","1","0","None","-1"
51902,"NSLOCTEXT("""", ""B4286E9C4FF55A48670B17885A7A4259"", ""Setite Ritual Knife"")","NSLOCTEXT("""", ""3CABE3F34C0D74C53FD7C291F1C57384"", ""A formal dagger used for ritualistic killings"")","NSLOCTEXT("""", ""AB18104C4F7464335FC454B7516D854A"", ""<span style=\""italic\""> She has instituted human sacrifice, and since her mating with Constantius, no less then five hundred men, women and children have been immolated. Some of these have died on the altar she has set up in the temple, herself wielding the sacrificial dagger, but most have met a more horrible doom. </>\nA Witch Shall be Born\n\nThe devotees of Set are spread far and wide in the lands of Stygia and the Old Serpent demands human sacrifice as a part of his worship.\nThese daggers are crafted in the thousands at the forges of Luxur and then spread to the priesthood of the Serpent god.\nWhile the rituals of Set are many and depraved, the fastest is bending a victim over an altar and cutting their heart from their chest."")","/Game/UI/Textures/Icons/icon_sacrificial_knife.icon_sacrificial_knife","/Game/Items/BPGameItemWeapon.BPGameItemWeapon_C","None","/Game/Items/Weapons/Dagger_Offhand/BP_dagger_oh.BP_dagger_oh_C","None","1","2","Weapon","0.000000","9","SetTool","OneHanded","","2","2","0","0","0.000000","1.000000","1.230000","35.000000","250.000000","17","23","0","0","0","0","0","0","1","33","180.000000","1.000000","0.000000","0.000000","0.000000","1","0.108000","0","0","0","0","Stone","0","0","0","/Game/Items/Weapons/Dagger/SM_stygia_dagger_set_iron.SM_stygia_dagger_set_iron","None","/Game/Items/Weapons/Dagger/SM_stygia_dagger_set_iron_DM.SM_stygia_dagger_set_iron_DM","0","0","0","0.000000","0","60.000000","0","0","1","10001","15","1","0","0","1","0","0","0","NSLOCTEXT("""", ""B2D34CCC4E3CFAC2A9368B9FC6A213C3"", ""Low Grade"")","NSLOCTEXT("""", ""8C17BF1447AF66AB23CACAA45CD43FB5"", ""Weapon"")","","","0","0","0.000000","1","0","None","-1"
